{
  "$schema": "https://cloud.uipath.com/draft/2024-12/uipath",
  "runtimeOptions": {
    "isConversational": false
  },
  "packOptions": {
    "fileExtensionsIncluded": [],
    "filesIncluded": [],
    "filesExcluded": [],
    "directoriesExcluded": [],
    "includeUvLock": true
  },
  "functions": {
    "main": "main.py:main",
    "triage": "main.py:triage"
  },
  "agents": {}
}